{
  "actor_id": "tool:sol_executor",
  "cells_executed": [
    "cell:cell_001",
    "cell:cell_010",
    "cell:cell_011",
    "cell:cell_014"
  ],
  "completed_at": "2026-01-01T00:09:05Z",
  "entry_point": "cell:cell_001",
  "environment_id": "env_001",
  "output_bindings": [
    {
      "mime_type": "application/x-parquet",
      "named_output": "cell:cell_014#metrics_table",
      "object_ref": "object:sha256:d36e8fc345567dee67411d3c26a48bf2c03255ba84814d8219a051240866aa31"
    }
  ],
  "resource_usage": {
    "cpu_time_ms": 4100,
    "peak_memory_bytes": 52428800,
    "wall_time_ms": 5000
  },
  "result_commit": null,
  "run_id": "run_012",
  "source_commit": "commit:commit_042",
  "started_at": "2026-01-01T00:09:00Z",
  "status": "success",
  "task_ref": "record:task_001"
}